id,name,text,trans
4901028460010,千雪,"手作りにするとして、中身どうしようかな──
マシュマロ、生チョコ、焼き菓子……","수제로 한다고 치고, 내용물을 어떻게 하지──
마시멜로, 생초코, 구운 과자……"
4901028460020,千雪,"ラッピングの柄も……
無地、水玉、チェック、花柄、ボタニカル、雪模様……","포장 무늬도……
민무늬, 물방울, 체크, 꽃무늬, 보타니컬, 눈무늬……"
4901028460030,千雪,"入れ物は……
紙袋、巾着、それに、飾り紐か、シール……？","통은……
종이, 주머니, 그리고, 장식 끈 아니면 씰……?"
4901028460040,千雪,"いっぱい考えることが多くて、迷っちゃうけど……
楽しいな……","고심할 게 많아서, 고민은 되는데……
재밌네……"
4901028460050,千雪,ありがとうございます、プロデューサーさん,"감사합니다, 프로듀서님"
4901028460060,千雪,"ただ、差し上げるつもりだったのに……
私も、たくさん頂いちゃってます","그냥 드리려고 했는데……
저도, 많이 받고 있네요"
info,special_communications/490102846.json,
번역자,,
