id,name,text,trans
4901026220010,咲耶,"フフ……
いい香りだ……","후후……
좋은 향기야……"
4901026220020,咲耶,"──…………うん、美味しい
素敵なプレゼントをありがとう、プロデューサー","──…………음, 맛있어
멋진 선물 고마워, 프로듀서"
0000000000000,プロデューサー,どういたしまして,천만에
0000000000000,プロデューサー,"紅茶を渡したら、流れるように
お茶の準備がととのったのには驚いたけど──","홍차를 주니, 물 흐르듯
차의 준비가 된 건 놀랐는데──"
4901026220030,咲耶,"申し訳ないが、慣れてほしい
私は喜びを共有したい質でね","미안하지만, 익숙해졌으면 해
나는 기쁨은 공유하고 싶은 편이니까"
0000000000000,プロデューサー,"はは
そうだな、わかってるつもりだよ","하하
그렇지, 알고 있었을 텐데"
0000000000000,プロデューサー,"だからこの時間ごと、
いいプレゼントになってくれたら俺も嬉しい","그러니까 이 시간처럼,
좋은 선물이 되었다면 나도 기뻐"
info,special_communications/490102622.json,
번역자,,
