id,name,text,trans
4901026610010,千雪,"ハンドクリーム……！
ちょうど今、買いにいこうかなって思ってたものなんです","핸드 크림……!
마침, 사러 갈까 생각했었어요"
4901026610020,千雪,ふふっ、赤と緑のリボン、可愛い……,"후훗, 빨강 초록 리본, 귀여워……"
4901026610030,千雪,"塗ってみてもいいですか？
プロデューサーさん","발라봐도 될까요?
프로듀서님"
0000000000000,プロデューサー,"ああ、もちろん
好みに合うといいんだけど","응, 물론이지
마음에 들었으면 좋겠는데"
4901026610040,千雪,"ん……バニラとシナモンの匂い……
なんだかとってもクリスマスって感じです……","음…… 바닐라와 시나몬 향……
왠지 굉장히 크리스마스 느낌이에요……"
4901026610050,千雪,"プロデューサーさんも、
塗ってみません？","프로듀서님도,
발라보실래요?"
4901026610060,千雪,"うきうきするんですよ
動かすたびに、素敵な香りがして……！","신난다구요
움직일 때마다, 좋은 향기가 나서……!"
info,special_communications/490102661.json,
번역자,,
