id,name,text,trans
0000000000000,宣伝担当,"――いやあ、アルストロメリア初のワンマンライブ！
私も一人のファンとして、楽しみにしているんです！","――이야, 알스트로메리아 첫 단독 라이브!
저도 한 사람의 팬으로서, 기대하고 있습니다!"
0000000000000,宣伝担当,"千雪さんからもいろいろ参考になるお話を聞けましたし、
イメージもりもり沸いてきました！　絶対成功させましょう","치유키 씨에게서도 이것저것 참고가 될 얘기를 들어서
이미지가 팍팍 솟아오르네요! 반드시 성공시키죠"
1016004020010,千雪,よかった……！,다행이다……!
1016004020020,千雪,"好きにお話ししてしまったので、
お役に立てるかどうか、少し不安だったんです","제 마음대로 얘기해버려서,
도움이 될지 어떨지, 조금 불안했어요"
0000000000000,宣伝担当,"いえいえ、アルストロメリアの世界観については
大切に扱っていきたいと思っておりますから……","아뇨아뇨, 알스트로메리아의 세계관에 관해서는
소중하게 다루고 싶다고 생각하고 있으니까요……"
0000000000000,プロデューサー,よろしくお願いいたします,잘 부탁드립니다
0000000000000,宣伝担当,"ネットを媒体とした広告は先ほどお話ししたような形で
展開できればと思いますので……！","인터넷 광고는 앞에 말씀드린 것 같은 형태로
전개 가능하면 좋겠습니다……!"
0000000000000,プロデューサー,"かしこまりました
事務所に戻りましたら、素材を送らせていただきます","알겠습니다
사무소에 돌아가면, 소재를 보내드리겠습니다"
1016004020030,千雪,"他にも私たちに協力できることがありましたら、
なんでもおっしゃってください……！","이외에 저희들이 도와드릴 게 있으면,
뭐든지 알려주세요……!"
1016004020040,千雪,"いろいろな方と協力して、
素敵なライブをつくっていきたいので――！","다양한 분들과 협력해서,
멋진 라이브를 만들어가고 싶어요――!"
0000000000000,宣伝担当,"ありがとうございます、
心強いですね……","감사합니다,
든든하네요……"
0000000000000,宣伝担当,そうだ、でしたら――！,"그래, 그렇다면――!"
0000000000000,宣伝担当,まだジャストアイデアの段階なのですが――,아직 그냥 아이디어 단계지만――
0000000000000,宣伝担当,"先日、千雪さんはツイスタで、
自作のプレイリストについて触れてらっしゃいましたね？","요전에, 치유키 씨가 트위스터에,
자작 플레이리스트 얘기를 하셨죠?"
1016004020050,千雪,"はい……
思ったより反響があって、少しびっくりしていました","네……
생각보다 반응이 있어서, 조금 놀랐어요"
0000000000000,宣伝担当,ええ、そちらの件から考えたんですが……,"네, 그 건으로 생각해봤는데……"
0000000000000,宣伝担当,"音楽サブスクと提携して、アルストロメリアの
新規ファン向けプレイリストを公開したいなと……！","스트리밍 사이트와 제휴해서, 알스트로메리아의
새로운 팬을 위한 플레이리스트를 공개하고 싶어요……!"
0000000000000,宣伝担当,"そのプレイリスト作成を、
千雪さんにお願いできないでしょうか","그 플레이리스트 작성을,
치유키 씨에게 부탁드리고 싶은데요"
1016004020060,千雪,私に、ですか……？,"제게, 말인가요……?"
0000000000000,宣伝担当,はい！,네!
0000000000000,宣伝担当,"千雪さんのプレイリストの曲目、知りたいなあって思う方、
ツイスタのコメントにもたくさんいましたよね","치유키 씨의 플레이리스트, 알고 싶다고 생각하는 분,
트위스터 코멘트도 꽤 많았죠"
1016004020070,千雪,"ええ、曲の権利とか……いろいろあるかな、って思って
リストは公開できなかったんですけど……","네, 곡의 권리라든가…… 여러 모로 생각해야될 게 있지 않나 싶어서
리스트는 공개 못 했었는데요……"
0000000000000,宣伝担当,"そうじゃないかなって思ってました……！
なので――","그럴 것 같다고 생각했어요……!
그래서――"
0000000000000,宣伝担当,"その時残念な思いをした既存のファンの方にも喜ばれ、
新規のファンの方には指針となるような……","그때 아쉬웠던 기존 팬분도 좋고,
새로운 팬분에게도 지침이 될 만한……"
0000000000000,宣伝担当,"そんなアルストロメリアの曲目リストを
作っていただきたいんです","그런 알스트로메리아의 곡 리스트를
만들어 주셨으면 합니다"
0000000000000,宣伝担当,"あ、リストの解説もいただけるとありがたく……
千雪さんのものの見方や考え方、私とっても好きなんです！","아, 리스트의 해설도 있으면 좋겠네요……
치유키 씨가 사물을 보고 생각하는 방식, 저 정말 좋아하거든요!"
1016004020080,千雪,えっと、それは……,"저기, 그건……"
0000000000000,プロデューサー,"とても素敵なご提案ですが、
各所と調整が必要になるかもしれませんので……","정말 좋은 제안입니다만,
여러 곳과 조정이 필요할지도 몰라서……"
0000000000000,プロデューサー,"すみません、
いったん持ち帰らせていただけますか？","실례지만,
일단 제안만 받아가도 될까요?"
0000000000000,宣伝担当,もちろんです！,물론이죠!
0000000000000,宣伝担当,でもでも、前向きにご検討くださいね……！,"그래도, 긍정적으로 검토해주세요……!"
1016004020090,千雪,"……ありがとうございます
プロデューサーさん","……감사합니다
프로듀서님"
1016004020100,千雪,リストのこと……,리스트 얘기……
0000000000000,プロデューサー,ああ、あまり乗り気じゃない気がしたからさ,"아아, 그렇게 내켜하는 것 같지 않아서"
0000000000000,プロデューサー,"即決しなきゃならない案件でもなかったし、
全然気にしないでくれていいぞ","바로 결정할 안건도 아니고,
전혀 신경 쓸 필요 없어"
1016004020110,千雪,そう……でしたか,그런……가요
1016004020120,千雪,"あまり乗り気じゃない――
プロデューサーさんのおっしゃる通りです","그다지 내키지 않는다――
프로듀서님 말이 맞아요"
1016004020130,千雪,"できることがあったら何でもおっしゃってください、なんて
言っておいて、気が引けるんですけど……","할 수 있는 건 뭐든 말해주세요, 라고
해놓고는, 부끄럽긴 하지만요……"
0000000000000,プロデューサー,"うん
……気が進まない理由、教えてもらえるか？","응
……내키지 않는 이유, 알려줄 수 있어?"
1016004020140,千雪,はい……,네……
1016004020150,千雪,"プレイリストって、どうやっても作った人の、
らしさといいますか……","플레이리스트란 건, 어떻게 만들든 만든 사람의,
'다움'이라고 할까요……"
1016004020160,千雪,個性が出てしまうと思うんです,개성이 나온다고 생각해요
0000000000000,プロデューサー,そうだな,그렇지
0000000000000,プロデューサー,前に、本棚に例えてくれたことがあったの、覚えてるよ,"전에, 책장을 예로 들었던 거, 기억하고 있어"
1016004020170,千雪,"あの時、リストのことを千雪の世界、って
おっしゃってくれましたね","그때, 리스트를 치유키의 세계, 라고
말씀해 주셨죠"
1016004020180,千雪,……とっても嬉しかったです,……정말 기뻤어요
1016004020190,千雪,でも、だからこそ……,"하지만, 그러니까……"
1016004020200,千雪,"アルストロメリアを初めて聴く人に、
私が色をつけたものを正解だって思ってほしくない……","알스트로메리아를 처음 듣는 사람에게,
내가 색을 입힌 것을 정답이라고 하고 싶진 않다……"
1016004020210,千雪,"アルストロメリアは、聴く人の数だけ違う世界で……
違う咲き方をしてほしい……って思ってしまって……","알스트로메리아는, 듣는 사람의 수만큼 각자 다른 세계에서……
각자 다르게 꽃피었으면 한다……라고 생각해버려서……"
0000000000000,プロデューサー,……なるほどな,……그렇구나
0000000000000,プロデューサー,"千雪が解説をつけて出してしまうと余計、
それが正解だ、って方向に進みそうだもんな……","치유키가 해설을 해버리면 한층 더,
그것이 정답, 이라는 방향을 띠게 되겠구나……"
1016004020220,千雪,"プレイリストが宣伝材料になること、
初めて聴く人に指針があった方がいいこともわかるんです","플레이리스트가 홍보재료가 되고,
처음 듣는 분을 위한 지침이 있는 게 좋다는 것도 알아요"
1016004020230,千雪,なので、心苦しいんですけど……,"그래서, 마음은 불편하지만……"
0000000000000,プロデューサー,大丈夫だ、千雪,"괜찮아, 치유키"
0000000000000,プロデューサー,"千雪の感じ方にひかれて、
アルストロメリアのファンになった人もたくさんいる","치유키가 느끼는 방법에 이끌려서,
알스트로메리아의 팬이 된 사람도 잔뜩 있어"
0000000000000,プロデューサー,"千雪が抵抗感がある企画は……
その人達にも受け入れられないんじゃないかな","치유키가 거부감을 느끼는 기획은……
그 사람들에게도 받아들여지지 않는 게 아닐까"
0000000000000,プロデューサー,……何か、他の方法を探してみよう,"……무언가, 다른 방법을 찾아보자"
1016004020240,千雪,ありがとうございます、プロデューサーさん,"고맙습니다, 프로듀서님"
1016004020250,千雪,私も、考えてみますね,"저도, 생각해볼게요"
info,produce_events/101600402.json,
번역자,,
