id,name,text,trans
4901026620010,千雪,"わあ、アンティークレース！
いいんですか、頂いちゃって","와아, 앤틱 레이스!
괜찮을까요, 받아도"
0000000000000,プロデューサー,"ああ、さっき商店街で見かけてな
なんだかいいなって思ってさ","응, 방금 상점가에서 봤는데
왠지 좋다 생각이 들었어"
4901026620020,千雪,"ふふっ、私も、こういうの大好きなんです
ありがとうございます……","후훗, 저도, 이런 거 정말 좋아해요
고맙습니다……"
4901026620030,千雪,"この縁なんて、ため息が出るくらい丁寧なつくりで……
ずっと見ていられそう","이 테두리, 한숨이 나올 정도로 정중한 만듦새라……
계속 보고 있을 수 있을 것 같아"
4901026620040,千雪,部屋の窓に飾ろうかなぁ……,방의 창에 장식할까……
4901026620050,千雪,"────とっても素敵だと思うんです
レースを通して、光が揺れるの……！","────정말로 멋지다고 생각해요
레이스를 통해서, 빛이 흔들리는 것……!"
info,special_communications/490102662.json,
번역자,,
